코드,날짜,시간,언론사,기사제목,링크,기사내용,기사 내용
005930,2020.06.17,7,조세일보,"[김대성의 종목분석] 진격의 삼성바이오, 주가 6거래일째 상승…연중 최...",https://finance.naver.com/item/news_read.nhn?article_id=0002225537&office_id=123&code=005930&page=6&sm=,"6월 8일 이후 24.4% 상승…작년 8월6일보다 3.4배 급등개인투자자 비중 늘고 공매도 금지와 맞물려 상승 모멘텀◆…삼성바이오의 최근 1년간 주가 변동 추이. 화면캡처=키움증권삼성바이오로직스가 6거래일째 상승세를 유지하며 진격의 행진을 계속하고 있습니다.삼성바이오는 16일 전일보다 1만8000원(2.2%) 오른 82만6000원에 거래를 마쳤습니다. 지난 8일의 종가 66만4000원에서 6거래일째 오르며 24.4% 상승폭을 보였습니다. 액면가는 2500원입니다.삼성바이오의 주가는 연초인 1월 2일의 42만8500원보다 92.8% 올랐고 52주 저점인 지난해 8월 6일의 24만1500원에 비해서는 3.4배 급등한 수준입니다.삼성바이오의 주가는 세계적인 코로나19 재확산 우려가 커지면서 바이오 업종의 상승 분위기에 편승해 동반 오름세를 보였습니다.게다가 삼성바이오는 지난 8일 스위스 소재 제약사와 433억원, 2462억원 규모의 바이오의약품 위탁생산계약 2건을 체결했다고 공시했습니다.이 중 433억원 규모의 계약의 경우 최소 확정금액으로 향후 계약상 보장된 조건을 달성하면 수주액은 최대 4억 달러(약 4800억원)까지 늘어날 수 있습니다.지난 7일에는 자회사인 삼성바이오에피스가 미국 식품의약국(FDA)에 이어 국내에서도 SB15의 임상 3상 승인을 받았다는 소식이 전해졌습니다. SB15는 안과질환 황반변성 치료제의 복제약입니다.상상인증권 하태기 연구원은 “바이오 업종 상승이 펀더멘털에 기반했다기보다는 주식시장의 수급 영향이 더 크다고 평가된다”며 “바이오 업종은 다음달까지 안정적으로 상승할 가능성이 높아 보인다”고 전망했습니다.하 연구원은 “삼성바이오는 2년간의 긴 조정을 거쳤고 개인투자자 비중 확대, 공매도 금지와 맞물리면서 주가 상승 모멘텀이 강했다”면서 “오는 8월 이후로는 공매도 금지 만료로 불안한 상승기가 될 것”이라고 진단했습니다.◆…자료=금융감독원 전자공시시스템삼성바이오는 올해 1분기 연결기준 매출액이 2072억원으로 전년동기에 비해 62.6% 증가했습니다. 영업이익과 당기순이익은 626억원, 367억원으로 각각 전년동기 적자에서 흑자로 전환했습니다.삼성바이오는 CMO(의약품 위탁생산)를 주된 사업으로 하고 있고 올해 1분기 매출은 항체의약품 생산이 2003억원으로 전체의 96.7%를 차지하고 있습니다.삼성바이오의 지배구조는 최대주주가 삼성물산으로 지분 43.44%(2874만2466주)를 보유하고 있습니다. 삼성물산의 최대주주는 이재용 삼성전자 부회장이며 지분 17.08%를 소유하고 있습니다.삼성바이오는 삼성전자가 지분 31.49%(2083만6832주)를 갖고 있습니다. 김태한 대표가 지분 0.07%(4만5500주)를 보유하고 있습니다.삼성바이오는 지분 1% 미만의 소액주주가 지난해말 집계를 기준으로 전체의 20.47%(1354만9638주)를 갖고 있는 것으로 나타났습니다.삼성바이오의 주가가 상승세를 유지할 수 있는 배경의 하나는 소액주주의 지분이 상대적으로 적기 때문에 시중에 유통물량이 적다는 점을 꼽을 수 있습니다.하나금융투자 최정욱 연구원은 “삼성바이오는 2016년 11월 상장 직후 6개월간은 주가가 큰 변화가 없다가 2017년 5월 이후 주가가 급등했다”면서 “1년반만에 주가가 3배 이상 상승하며 엄청난 고평가 논란을 불러왔다”고 지적했습니다.최 연구원은 “삼성바이오 상장 당시에 유통주식수가 20%에 불과해 상당히 적었을 뿐만 아니라 고평가 논란에 따라 국내외 기관들의 보유 비중이 상당히 적었던 편”이라고 설명했습니다.삼성바이오의 시가총액은 16일 54조6523억원 규모이며 삼성전자, SK하이닉스에 이어 시총 3위를 기록하고 있습니다.증권가에서는 삼성바이오가 코로나19 확산으로 수혜를 받게 될 가능성이 크며 실적이 뒷받침될 경우 고 PER(주가수익비율)주의 핸디캡을 극복할 수 있을 것으로 내다보고 있습니다.","6월 8일 이후 24.4% 상승…작년 8월6일보다 3.4배 급등개인투자자 비중 늘고 공매도 금지와 맞물려 상승 모멘텀◆…삼성바이오의 최근 1년간 주가 변동 추이. 화면캡처=키움증권삼성바이오로직스가 6거래일째 상승세를 유지하며 진격의 행진을 계속하고 있습니다.삼성바이오는 16일 전일보다 1만8000원(2.2%) 오른 82만6000원에 거래를 마쳤습니다. 지난 8일의 종가 66만4000원에서 6거래일째 오르며 24.4% 상승폭을 보였습니다. 액면가는 2500원입니다.삼성바이오의 주가는 연초인 1월 2일의 42만8500원보다 92.8% 올랐고 52주 저점인 지난해 8월 6일의 24만1500원에 비해서는 3.4배 급등한 수준입니다.삼성바이오의 주가는 세계적인 코로나19 재확산 우려가 커지면서 바이오 업종의 상승 분위기에 편승해 동반 오름세를 보였습니다.게다가 삼성바이오는 지난 8일 스위스 소재 제약사와 433억원, 2462억원 규모의 바이오의약품 위탁생산계약 2건을 체결했다고 공시했습니다.이 중 433억원 규모의 계약의 경우 최소 확정금액으로 향후 계약상 보장된 조건을 달성하면 수주액은 최대 4억 달러(약 4800억원)까지 늘어날 수 있습니다.지난 7일에는 자회사인 삼성바이오에피스가 미국 식품의약국(FDA)에 이어 국내에서도 SB15의 임상 3상 승인을 받았다는 소식이 전해졌습니다. SB15는 안과질환 황반변성 치료제의 복제약입니다.상상인증권 하태기 연구원은 “바이오 업종 상승이 펀더멘털에 기반했다기보다는 주식시장의 수급 영향이 더 크다고 평가된다”며 “바이오 업종은 다음달까지 안정적으로 상승할 가능성이 높아 보인다”고 전망했습니다.하 연구원은 “삼성바이오는 2년간의 긴 조정을 거쳤고 개인투자자 비중 확대, 공매도 금지와 맞물리면서 주가 상승 모멘텀이 강했다”면서 “오는 8월 이후로는 공매도 금지 만료로 불안한 상승기가 될 것”이라고 진단했습니다.◆…자료=금융감독원 전자공시시스템삼성바이오는 올해 1분기 연결기준 매출액이 2072억원으로 전년동기에 비해 62.6% 증가했습니다. 영업이익과 당기순이익은 626억원, 367억원으로 각각 전년동기 적자에서 흑자로 전환했습니다.삼성바이오는 CMO(의약품 위탁생산)를 주된 사업으로 하고 있고 올해 1분기 매출은 항체의약품 생산이 2003억원으로 전체의 96.7%를 차지하고 있습니다.삼성바이오의 지배구조는 최대주주가 삼성물산으로 지분 43.44%(2874만2466주)를 보유하고 있습니다. 삼성물산의 최대주주는 이재용 삼성전자 부회장이며 지분 17.08%를 소유하고 있습니다.삼성바이오는 삼성전자가 지분 31.49%(2083만6832주)를 갖고 있습니다. 김태한 대표가 지분 0.07%(4만5500주)를 보유하고 있습니다.삼성바이오는 지분 1% 미만의 소액주주가 지난해말 집계를 기준으로 전체의 20.47%(1354만9638주)를 갖고 있는 것으로 나타났습니다.삼성바이오의 주가가 상승세를 유지할 수 있는 배경의 하나는 소액주주의 지분이 상대적으로 적기 때문에 시중에 유통물량이 적다는 점을 꼽을 수 있습니다.하나금융투자 최정욱 연구원은 “삼성바이오는 2016년 11월 상장 직후 6개월간은 주가가 큰 변화가 없다가 2017년 5월 이후 주가가 급등했다”면서 “1년반만에 주가가 3배 이상 상승하며 엄청난 고평가 논란을 불러왔다”고 지적했습니다.최 연구원은 “삼성바이오 상장 당시에 유통주식수가 20%에 불과해 상당히 적었을 뿐만 아니라 고평가 논란에 따라 국내외 기관들의 보유 비중이 상당히 적었던 편”이라고 설명했습니다.삼성바이오의 시가총액은 16일 54조6523억원 규모이며 삼성전자, SK하이닉스에 이어 시총 3위를 기록하고 있습니다.증권가에서는 삼성바이오가 코로나19 확산으로 수혜를 받게 될 가능성이 크며 실적이 뒷받침될 경우 고 PER(주가수익비율)주의 핸디캡을 극복할 수 있을 것으로 내다보고 있습니다."
005930,2020.06.16,18,한국경제,"16일, 기관 거래소에서 삼성전자(+4.41%), KODEX 레버리지(...",https://finance.naver.com/item/news_read.nhn?article_id=0004361671&office_id=015&code=005930&page=6&sm=," 기관 투자자는 16일 거래소에서 삼성전자, KODEX 레버리지, NAVER 등을 중점적으로 사들인 것으로 나타났다.기관 투자자의 순매수 상위 20개 종목은 삼성전자, KODEX 레버리지, NAVER, LG화학, SK하이닉스, KODEX WTI원유선물(H), KODEX 코스닥150 레버리지, 삼성SDI, 삼성물산, 삼성전기등이다.이중에 전기,전자 업종에 속한 종목이 4개 포함되어 있다.이날 기관 투자자가 순매수한 종목들 중에 삼성전자, KODEX 레버리지, NAVER 등은 전일 대비 주가가 상승했다.[06월16일]거래소 기관 순매수 상위 종목한경로보뉴스이 기사는 한국경제신문과 금융 AI 전문기업 씽크풀이 공동 개발한 기사 자동생성 알고리즘에 의해 실시간으로 작성된 것입니다."," 기관 투자자는 16일 거래소에서 삼성전자, KODEX 레버리지, NAVER 등을 중점적으로 사들인 것으로 나타났다.기관 투자자의 순매수 상위 20개 종목은 삼성전자, KODEX 레버리지, NAVER, LG화학, SK하이닉스, KODEX WTI원유선물(H), KODEX 코스닥150 레버리지, 삼성SDI, 삼성물산, 삼성전기등이다.이중에 전기,전자 업종에 속한 종목이 4개 포함되어 있다.이날 기관 투자자가 순매수한 종목들 중에 삼성전자, KODEX 레버리지, NAVER 등은 전일 대비 주가가 상승했다.[06월16일]거래소 기관 순매수 상위 종목한경로보뉴스이 기사는 한국경제신문과 금융 AI 전문기업 씽크풀이 공동 개발한 기사 자동생성 알고리즘에 의해 실시간으로 작성된 것입니다."
005930,2020.06.16,17,매일경제,"장원기 前삼성사장, 中반도체사 안간다",https://finance.naver.com/item/news_read.nhn?article_id=0004596645&office_id=009&code=005930&page=6&sm=," 장원기 전 삼성전자 사장(사진)이 중국 반도체 기업인 에스윈 부회장(부총경리)직에서 물러나기로 했다.16일 업계에 따르면 장 전 사장은 최근 중국 반도체 기업 부회장 취임이 언론 보도를 통해 알려지고 일부에서 비난이 일자 사임하기로 하고 이를 삼성전자 측에 알렸다.업계 관계자는 ""장 전 사장이 에스윈의 회장인 왕둥성 전 BOE 회장과의 개인적 친분으로 경영 자문을 맡은 것인데, 비난의 목소리가 커지자 부담을 느꼈다""며 ""더 이상 오해를 불러일으키지 않고 삼성 후배들에게 피해가 되지 않기 위해 사임하기로 했다""고 설명했다.장 전 사장은 올 초 디스플레이 구동칩 등 반도체 제조업체인 에스윈 부회장으로 선임됐다. 삼성전자의 사장급 인사가 중국 반도체 기업의 부회장으로 선임됐다는 소식에 국내 디스플레이·반도체 업계에서 논란이 됐다.장 전 사장은 1981년 삼성전자 반도체사업부에 입사해 39년간 삼성맨으로 일하며 사장을 지냈다. LCD 사업을 주로 담당하며 LCD사업부장(사장)을 역임하고, 2011년부터 중국삼성 사장, 삼성전자 중국전략협력실장 등을 거쳐 2019년 퇴임했다.  [전경운 기자]"," 장원기 전 삼성전자 사장(사진)이 중국 반도체 기업인 에스윈 부회장(부총경리)직에서 물러나기로 했다.16일 업계에 따르면 장 전 사장은 최근 중국 반도체 기업 부회장 취임이 언론 보도를 통해 알려지고 일부에서 비난이 일자 사임하기로 하고 이를 삼성전자 측에 알렸다.업계 관계자는 ""장 전 사장이 에스윈의 회장인 왕둥성 전 BOE 회장과의 개인적 친분으로 경영 자문을 맡은 것인데, 비난의 목소리가 커지자 부담을 느꼈다""며 ""더 이상 오해를 불러일으키지 않고 삼성 후배들에게 피해가 되지 않기 위해 사임하기로 했다""고 설명했다.장 전 사장은 올 초 디스플레이 구동칩 등 반도체 제조업체인 에스윈 부회장으로 선임됐다. 삼성전자의 사장급 인사가 중국 반도체 기업의 부회장으로 선임됐다는 소식에 국내 디스플레이·반도체 업계에서 논란이 됐다.장 전 사장은 1981년 삼성전자 반도체사업부에 입사해 39년간 삼성맨으로 일하며 사장을 지냈다. LCD 사업을 주로 담당하며 LCD사업부장(사장)을 역임하고, 2011년부터 중국삼성 사장, 삼성전자 중국전략협력실장 등을 거쳐 2019년 퇴임했다.  [전경운 기자]"
005930,2020.06.16,15,매일경제,"중국행 논란 장원기 전 삼성전자 사장, 中반도체 기업 부회장직 사임키...",https://finance.naver.com/item/news_read.nhn?article_id=0004596405&office_id=009&code=005930&page=6&sm=," 장원기 전 삼성전자 사장이 중국 반도체 기업인 에스윈 부회장직에서 물러나기로 했다.16일 업계에 따르면 장 전 사장은 최근 본인의 중국 반도체 기업 부회장(부총경리)직 취임이 언론 보도를 통해 알려지고 일부에서 비난이 일자 사임하기로 하고 이를 삼성전자 측에 알렸다.업계 관계자는 ""장 전 자사장이 에스윈의 회장인 왕둥성 전 BOE 회장과의 개인적 친분으로 경영자문을 맡은 것인데, 비난의 목소리가 커지자 부담을 느꼈다""며 ""더 이상 오해를 불러일으키지 않고 삼성 후배들에게 피해가 되지 않기 위해 사임하기로 했다""고 설명했다.장 전 사장은 올 초 디스플레이 구동칩 등 반도체 제조업체인 중국 에스윈 부회장으로 선임됐다. 삼성전자의 사장급 인사가 중국 반도체 기업의 부회장으로 선임됐다는 소식에 국내 디스플레이·반도체 업계에서 논란이 됐다.장 전 사장은 1981년 삼성전자 반도체사업부로 입사해 36년간 삼성맨으로 일하며 사장을 지냈다. LCD 사업을 주로 담당하며 LCD사업부장(사장)을 역임하고, 2011년부터 중국삼성 사장, 삼성전자 중국전략협력실장 등을 거쳐 지난 2017년 퇴임했다. [전경운 기자]"," 장원기 전 삼성전자 사장이 중국 반도체 기업인 에스윈 부회장직에서 물러나기로 했다.16일 업계에 따르면 장 전 사장은 최근 본인의 중국 반도체 기업 부회장(부총경리)직 취임이 언론 보도를 통해 알려지고 일부에서 비난이 일자 사임하기로 하고 이를 삼성전자 측에 알렸다.업계 관계자는 ""장 전 자사장이 에스윈의 회장인 왕둥성 전 BOE 회장과의 개인적 친분으로 경영자문을 맡은 것인데, 비난의 목소리가 커지자 부담을 느꼈다""며 ""더 이상 오해를 불러일으키지 않고 삼성 후배들에게 피해가 되지 않기 위해 사임하기로 했다""고 설명했다.장 전 사장은 올 초 디스플레이 구동칩 등 반도체 제조업체인 중국 에스윈 부회장으로 선임됐다. 삼성전자의 사장급 인사가 중국 반도체 기업의 부회장으로 선임됐다는 소식에 국내 디스플레이·반도체 업계에서 논란이 됐다.장 전 사장은 1981년 삼성전자 반도체사업부로 입사해 36년간 삼성맨으로 일하며 사장을 지냈다. LCD 사업을 주로 담당하며 LCD사업부장(사장)을 역임하고, 2011년부터 중국삼성 사장, 삼성전자 중국전략협력실장 등을 거쳐 지난 2017년 퇴임했다. [전경운 기자]"
005930,2020.06.16,17,매일경제,신형 플스·엑박 소식에…삼성전자 `방긋`,https://finance.naver.com/item/news_read.nhn?article_id=0004596622&office_id=009&code=005930&page=6&sm=,"소니· MS 신제품 하반기 출시스마트폰보다 용량 4배 큰 D램8배 큰 낸드플래시 탑재해반도체 수요 늘어날 가능성서버용D램도 아마존 수요 탄탄증권가 ""올 영업익 15% 증가"" 한국 경제 마지막 보루인 반도체 산업에 대한 우려가 커지는 가운데서도 증권가에선 올해 삼성전자 실적에 대한 긍정적 전망이 나오고 있다. 코로나19에 따른 실물 부문 충격이 점차 가시화되고 있지만 하반기에 나올 호재 덕분에 실적 선방이 예상된다는 것이다16일 하나금융투자는 리포트를 통해 하반기부터 삼성전자와 SK하이닉스의 주력 상품인 D램과 낸드플래시 수요가 늘어날 것으로 내다봤다. 올해 가정용 콘솔게임기시장 양대 산맥인 소니와 마이크로소프트(MS)가 신형 게임기를 출시하기 때문이다. 소니는 연내 플레이스테이션(PS)5를 내놓고 마이크로소프트도 엑스박스(Xbox) 시리즈 X를 비슷한 시기에 출시할 계획이다.하나금융투자는 게임기에 들어가는 D램에 주목했다. 김경민 하나금융투자 애널리스트는 ""스마트폰 D램 평균 탑재량이 4GB인 반면 두 게임기에는 16GB가 들어갈 것으로 보인다""며 ""출시 후 게임기 연간 판매량을 PS5 1600만대, 엑스박스 시리즈 X 500만대로 추산한다면 D램 용량을 기준으로 놓고 봤을 때 스마트폰 8400만대가 판매되는 것과 유사하다""고 분석했다.낸드플래시의 경우 김 애널리스트는 ""신제품의 낸드플래시 용량은 PS5 825GB, 엑스박스 시리즈 X는 1TB로 추정되므로 스마트폰 평균 탑재량(120GB) 대비 각각 6.9배, 8.3배 수준""이라고 밝혔다. 이에 따라 콘솔게임기 신제품 판매의 수요 견인 효과는 2019년을 기준으로 했을 때 D램은 2.1%, 낸드플래시는 5.8%씩 증가할 것이라는 게 하나금융투자 전망이다. 물론 실제 두 게임기가 가정한 만큼 판매량을 달성할 수 있을지는 미지수이고 판매량 상당 부분은 내년으로 넘어갈 수 있다는 점을 감안해야 한다.그럼에도 코로나19로 인해 게임시장이 활성화되고 있는 데다 7년 만에 등장하는 신모델인 만큼 업계 기대가 큰 것도 사실이다. 게임업계 관계자는 ""국내에선 콘솔게임기가 게임시장에서 큰 비중을 차지하지 않지만 글로벌시장에선 큰 비중을 차지하고 있다""며 ""코로나19로 게임기에 대한 관심도 높아 업계 기대가 크다""고 말했다.이와 함께 서버용 D램시장 큰손인 아마존 덕에 하반기 서버용 D램 부문 수요도 어느 정도 유지될 것이란 분석이 나온다. 현재 서버용 D램 수요 가격에 대해선 부정적 전망이 많다. 삼성증권은 최근 리포트를 통해 ""마이크로소프트가 코로나19로 영상회의가 증가할 것을 예상하고 상반기 주문을 크게 늘렸는데 올해 예상 주문량의 75%를 이미 쓴 것으로 보인다""고 분석했다. 이에 따라 하반기에는 그만큼 주문이 줄어들 것으로 전망된 것이다.그러나 하반기 서버용 D램 수요 급감은 없을 것이라는 의견이 나온다. 황민성 삼성증권 이사는 ""서버용 D램 수요에서 마이크로소프트가 차지하는 비중은 10% 수준으로 크지 않다""며 ""15%를 차지하는 아마존의 경우 상반기에 주문을 크게 늘리지 않았고 하반기에도 예상된 구매량을 안정적으로 사갈 것으로 보인다""고 말했다. 증권가 실적 전망도 이러한 점을 반영하고 있다. 16일 금융정보제공업체 에프앤가이드에 따르면 올해 연결기준 삼성전자의 매출액과 영업이익 전망치는 각각 230조1862억원과 31조9674억원이다. 작년 매출액 230조4009억원과 영업이익 27조7685억원에 비하면 매출액은 약간 감소하지만 영업이익은 15% 넘게 증가할 것으로 전망된 것이다. 주가 기대감도 높다. 이순학 한화투자증권 애널리스트는 이날 리포트를 통해 ""목표주가 6만7000원, 투자의견 매수를 유지한다""고 밝혔다. 삼성전자 주가는 이날 5만2100원으로 장을 마감하며 전일 대비 4.41% 올라 다시 5만원대를 회복했다. [우제윤 기자]","소니· MS 신제품 하반기 출시스마트폰보다 용량 4배 큰 D램8배 큰 낸드플래시 탑재해반도체 수요 늘어날 가능성서버용D램도 아마존 수요 탄탄증권가 ""올 영업익 15% 증가"" 한국 경제 마지막 보루인 반도체 산업에 대한 우려가 커지는 가운데서도 증권가에선 올해 삼성전자 실적에 대한 긍정적 전망이 나오고 있다. 코로나19에 따른 실물 부문 충격이 점차 가시화되고 있지만 하반기에 나올 호재 덕분에 실적 선방이 예상된다는 것이다16일 하나금융투자는 리포트를 통해 하반기부터 삼성전자와 SK하이닉스의 주력 상품인 D램과 낸드플래시 수요가 늘어날 것으로 내다봤다. 올해 가정용 콘솔게임기시장 양대 산맥인 소니와 마이크로소프트(MS)가 신형 게임기를 출시하기 때문이다. 소니는 연내 플레이스테이션(PS)5를 내놓고 마이크로소프트도 엑스박스(Xbox) 시리즈 X를 비슷한 시기에 출시할 계획이다.하나금융투자는 게임기에 들어가는 D램에 주목했다. 김경민 하나금융투자 애널리스트는 ""스마트폰 D램 평균 탑재량이 4GB인 반면 두 게임기에는 16GB가 들어갈 것으로 보인다""며 ""출시 후 게임기 연간 판매량을 PS5 1600만대, 엑스박스 시리즈 X 500만대로 추산한다면 D램 용량을 기준으로 놓고 봤을 때 스마트폰 8400만대가 판매되는 것과 유사하다""고 분석했다.낸드플래시의 경우 김 애널리스트는 ""신제품의 낸드플래시 용량은 PS5 825GB, 엑스박스 시리즈 X는 1TB로 추정되므로 스마트폰 평균 탑재량(120GB) 대비 각각 6.9배, 8.3배 수준""이라고 밝혔다. 이에 따라 콘솔게임기 신제품 판매의 수요 견인 효과는 2019년을 기준으로 했을 때 D램은 2.1%, 낸드플래시는 5.8%씩 증가할 것이라는 게 하나금융투자 전망이다. 물론 실제 두 게임기가 가정한 만큼 판매량을 달성할 수 있을지는 미지수이고 판매량 상당 부분은 내년으로 넘어갈 수 있다는 점을 감안해야 한다.그럼에도 코로나19로 인해 게임시장이 활성화되고 있는 데다 7년 만에 등장하는 신모델인 만큼 업계 기대가 큰 것도 사실이다. 게임업계 관계자는 ""국내에선 콘솔게임기가 게임시장에서 큰 비중을 차지하지 않지만 글로벌시장에선 큰 비중을 차지하고 있다""며 ""코로나19로 게임기에 대한 관심도 높아 업계 기대가 크다""고 말했다.이와 함께 서버용 D램시장 큰손인 아마존 덕에 하반기 서버용 D램 부문 수요도 어느 정도 유지될 것이란 분석이 나온다. 현재 서버용 D램 수요 가격에 대해선 부정적 전망이 많다. 삼성증권은 최근 리포트를 통해 ""마이크로소프트가 코로나19로 영상회의가 증가할 것을 예상하고 상반기 주문을 크게 늘렸는데 올해 예상 주문량의 75%를 이미 쓴 것으로 보인다""고 분석했다. 이에 따라 하반기에는 그만큼 주문이 줄어들 것으로 전망된 것이다.그러나 하반기 서버용 D램 수요 급감은 없을 것이라는 의견이 나온다. 황민성 삼성증권 이사는 ""서버용 D램 수요에서 마이크로소프트가 차지하는 비중은 10% 수준으로 크지 않다""며 ""15%를 차지하는 아마존의 경우 상반기에 주문을 크게 늘리지 않았고 하반기에도 예상된 구매량을 안정적으로 사갈 것으로 보인다""고 말했다. 증권가 실적 전망도 이러한 점을 반영하고 있다. 16일 금융정보제공업체 에프앤가이드에 따르면 올해 연결기준 삼성전자의 매출액과 영업이익 전망치는 각각 230조1862억원과 31조9674억원이다. 작년 매출액 230조4009억원과 영업이익 27조7685억원에 비하면 매출액은 약간 감소하지만 영업이익은 15% 넘게 증가할 것으로 전망된 것이다. 주가 기대감도 높다. 이순학 한화투자증권 애널리스트는 이날 리포트를 통해 ""목표주가 6만7000원, 투자의견 매수를 유지한다""고 밝혔다. 삼성전자 주가는 이날 5만2100원으로 장을 마감하며 전일 대비 4.41% 올라 다시 5만원대를 회복했다. [우제윤 기자]"
