코드,날짜,시간,언론사,기사제목,링크,기사내용,기사 내용
005930,2020.06.19,17,매일경제,하루 43% 출렁…미친 주가 삼성重 우선주,https://finance.naver.com/item/news_read.nhn?article_id=0004599007&office_id=009&code=005930&page=1&sm=,"10일 연속 상한가후 20% 뚝 10거래일 연속 상한가로 거래 정지됐던 삼성중공업 우선주(삼성중공우)가 거래 재개 후 20% 넘게 급락했다. 증권가에선 그동안 계속돼 왔던 폭탄 돌리기가 끝나고 마침내 폭탄이 터졌다는 반응이 나온다.19일 거래소에 따르면 삼성중공우는 59만2000원으로 장을 마감했다. 전 거래일 대비 20.43% 떨어졌다. 이날 삼성중공우 주가는 롤러코스터처럼 움직였다. 시가가 81만원으로 전 거래일(17일) 종가 74만4000원보다 9% 오른 금액으로 시작해 96만원까지 올랐지만 곧 하락세로 전환해 오전 중 54만8000원까지 떨어졌다. 최고가에 사서 최저가에 팔았다면 이날 하루 만에 약 43%를 손해 볼 수 있을 정도로 변동성이 극심했다. 오후 들어 주가는 다시 오름세로 돌아섰지만 결국 하락을 막지 못했다. 삼성중공우는 투자위험종목으로 지난 9일과 12일 거래정지 후에도 급등을 이어왔고 17일 10거래일 연속 상한가 달성 후 18일 거래 정지된 바 있다.증권가에선 올 것이 왔다는 평가다. 지난 1일 종가와 17일 종가를 비교했을 때 삼성중공업 보통주의 경우 약 30% 상승했지만 우선주는 13배로 급등하는 등 비정상적인 주가 움직임을 보였기 때문이다.이동헌 대신증권 애널리스트는 ""폭탄 돌리기가 마침내 끝났다""며 ""비정상적인 급등이 계속됐기 때문에 한 번 떨어지기 시작하면 하락세를 멈추기 쉽지 않을 것""이라고 말했다. 증권가에선 작전 세력의 개입 여부에 대해 수사가 이뤄질 가능성도 제기된다. 손해를 본 투자자들이 수사기관에 고소를 할 가능성이 있고 금융감독원도 조사에 착수할 수 있다. [우제윤 기자]","10일 연속 상한가후 20% 뚝 10거래일 연속 상한가로 거래 정지됐던 삼성중공업 우선주(삼성중공우)가 거래 재개 후 20% 넘게 급락했다. 증권가에선 그동안 계속돼 왔던 폭탄 돌리기가 끝나고 마침내 폭탄이 터졌다는 반응이 나온다.19일 거래소에 따르면 삼성중공우는 59만2000원으로 장을 마감했다. 전 거래일 대비 20.43% 떨어졌다. 이날 삼성중공우 주가는 롤러코스터처럼 움직였다. 시가가 81만원으로 전 거래일(17일) 종가 74만4000원보다 9% 오른 금액으로 시작해 96만원까지 올랐지만 곧 하락세로 전환해 오전 중 54만8000원까지 떨어졌다. 최고가에 사서 최저가에 팔았다면 이날 하루 만에 약 43%를 손해 볼 수 있을 정도로 변동성이 극심했다. 오후 들어 주가는 다시 오름세로 돌아섰지만 결국 하락을 막지 못했다. 삼성중공우는 투자위험종목으로 지난 9일과 12일 거래정지 후에도 급등을 이어왔고 17일 10거래일 연속 상한가 달성 후 18일 거래 정지된 바 있다.증권가에선 올 것이 왔다는 평가다. 지난 1일 종가와 17일 종가를 비교했을 때 삼성중공업 보통주의 경우 약 30% 상승했지만 우선주는 13배로 급등하는 등 비정상적인 주가 움직임을 보였기 때문이다.이동헌 대신증권 애널리스트는 ""폭탄 돌리기가 마침내 끝났다""며 ""비정상적인 급등이 계속됐기 때문에 한 번 떨어지기 시작하면 하락세를 멈추기 쉽지 않을 것""이라고 말했다. 증권가에선 작전 세력의 개입 여부에 대해 수사가 이뤄질 가능성도 제기된다. 손해를 본 투자자들이 수사기관에 고소를 할 가능성이 있고 금융감독원도 조사에 착수할 수 있다. [우제윤 기자]"
005930,2020.06.19,17,매일경제,"삼성, 화웨이 제치고 캐나다에 5G장비",https://finance.naver.com/item/news_read.nhn?article_id=0004598985&office_id=009&code=005930&page=1&sm=," ◆ 삼성 미래전략 속도 ◆ 삼성전자가 캐나다 3대 이동통신사업자인 텔러스(TELUS)의 5G 통신장비 공급사로 선정됐다.텔러스는 화웨이 통신장비를 100% 사용해왔지만 이번 5G 공급부터는 화웨이를 배제하기로 결정했다. 캐나다 등 미국의 반(反)화웨이 기류에 공조하는 국가에서 화웨이를 배제하는 사례가 속출하면서 글로벌 통신장비 시장에 균열이 생기고 있다. 화웨이의 빈자리를 차지하려는 경쟁 업체들의 수주 경쟁은 한층 치열해질 것으로 예상된다.삼성전자는 에릭슨, 노키아와 함께 캐나다 이동통신사업자 텔러스의 5G 통신장비 공급사로 선정됐다고 19일 밝혔다. 지난해 12월 캐나다 비디오트론, 올해 2월 미국 US셀룰러, 3월 뉴질랜드 스파크와의 5G 공급계약에 이은 네 번째 신규 수주다.텔러스는 캐나다 통신 시장에서 960만명(캐나다 전체 인구의 28%)의 가입자를 확보하고 있다. 경쟁사인 로저스(1080만명·31%) 벨(990만명·29%)과 함께 통신 시장을 3등분하고 있다. 캐나다 전체 인구는 약 3700만명이다. 캐나다는 아직 본격적으로 5G 통신이 상용화되지 않은 국가다. 내년에 5G 주파수 경매를 시작으로 5G 보급에 나설 예정이다. 텔러스의 통신장비 공급사 선정은 본격적인 5G 서비스를 앞둔 사전 준비 작업 성격으로, 삼성전자 등 3개 회사에서 어떤 장비를 얼마나 공급받을지는 정해지지 않았다.5G 장비 지원을 위해서는 4G 장비까지 같이 바꿔줘야 하기 때문에 텔러스 측 비용 부담이 작지 않을 전망이다. 독일 등 유럽 국가들이 화웨이 배제 움직임에 아직까지 소극적인 이유다.[이승윤 기자]"," ◆ 삼성 미래전략 속도 ◆ 삼성전자가 캐나다 3대 이동통신사업자인 텔러스(TELUS)의 5G 통신장비 공급사로 선정됐다.텔러스는 화웨이 통신장비를 100% 사용해왔지만 이번 5G 공급부터는 화웨이를 배제하기로 결정했다. 캐나다 등 미국의 반(反)화웨이 기류에 공조하는 국가에서 화웨이를 배제하는 사례가 속출하면서 글로벌 통신장비 시장에 균열이 생기고 있다. 화웨이의 빈자리를 차지하려는 경쟁 업체들의 수주 경쟁은 한층 치열해질 것으로 예상된다.삼성전자는 에릭슨, 노키아와 함께 캐나다 이동통신사업자 텔러스의 5G 통신장비 공급사로 선정됐다고 19일 밝혔다. 지난해 12월 캐나다 비디오트론, 올해 2월 미국 US셀룰러, 3월 뉴질랜드 스파크와의 5G 공급계약에 이은 네 번째 신규 수주다.텔러스는 캐나다 통신 시장에서 960만명(캐나다 전체 인구의 28%)의 가입자를 확보하고 있다. 경쟁사인 로저스(1080만명·31%) 벨(990만명·29%)과 함께 통신 시장을 3등분하고 있다. 캐나다 전체 인구는 약 3700만명이다. 캐나다는 아직 본격적으로 5G 통신이 상용화되지 않은 국가다. 내년에 5G 주파수 경매를 시작으로 5G 보급에 나설 예정이다. 텔러스의 통신장비 공급사 선정은 본격적인 5G 서비스를 앞둔 사전 준비 작업 성격으로, 삼성전자 등 3개 회사에서 어떤 장비를 얼마나 공급받을지는 정해지지 않았다.5G 장비 지원을 위해서는 4G 장비까지 같이 바꿔줘야 하기 때문에 텔러스 측 비용 부담이 작지 않을 전망이다. 독일 등 유럽 국가들이 화웨이 배제 움직임에 아직까지 소극적인 이유다.[이승윤 기자]"
005930,2020.06.19,9,헤럴드경제,"삼성전자, 캐나다 3대 이통사 '텔러스'에 5G 장비공급",https://finance.naver.com/item/news_read.nhn?article_id=0001688483&office_id=016&code=005930&page=1&sm=,"-최근 6개월 새 4건의 신규 수주 달성[헤럴드경제=박지영 기자] 삼성전자가 캐나다의 주요 이동통신사 텔러스에 5세대(G) 통신 장비를 공급한다.삼성전자는 캐나다의 3대 이동통신사 중 한 곳인 텔러스의 5G 장비 공급사로 선정됐다고 19일 밝혔다.이로써 삼성전자는 지난해 12월 비디오트론과의 계약으로 캐나다 통신 장비 시장에 진출한 후 두 번째 신규 수주를 기록했다.이를 포함 올해 들어 미국의 US셀룰러, 뉴질랜드의 스파크 등 글로벌 주요 통신사와의 계약에 이어 6개월 새 4건의 신규 수주 성과도 달성했다.텔러스는 1990년 설립된 캐나다의 인터넷 및 이동통신 사업자다. 로저스(Rogers), 벨(Bell)과 함께 캐나다의 3대 이동통신사 중 하나로 가입자 수는 약 960만명(점유율 28%)이다. 텔러스는 5G분야에 3년간 400억 캐나다 달러를 추가 투자할 계획이다.다렌 엔트위슬 텔러스 CEO(최고경영자)는 “통신기술 분야의 오랜 경험과 커넥티비티 분야의 전문성, 첨단 기술 등을 고려해 삼성전자를 공급사로 선정하게 됐다”고 말했다.전경훈 삼성전자 네트워크사업부장은 “5G 선도국에서 축적해 온 상용화 경험과 독보적인 네트워크 솔루션을 바탕으로 텔러스가 캐나다에서 5G 시대의 새 지평을 열어가는데 적극 협력할 것”이라고 말했다.park.jiyeong@heraldcorp.com","-최근 6개월 새 4건의 신규 수주 달성[헤럴드경제=박지영 기자] 삼성전자가 캐나다의 주요 이동통신사 텔러스에 5세대(G) 통신 장비를 공급한다.삼성전자는 캐나다의 3대 이동통신사 중 한 곳인 텔러스의 5G 장비 공급사로 선정됐다고 19일 밝혔다.이로써 삼성전자는 지난해 12월 비디오트론과의 계약으로 캐나다 통신 장비 시장에 진출한 후 두 번째 신규 수주를 기록했다.이를 포함 올해 들어 미국의 US셀룰러, 뉴질랜드의 스파크 등 글로벌 주요 통신사와의 계약에 이어 6개월 새 4건의 신규 수주 성과도 달성했다.텔러스는 1990년 설립된 캐나다의 인터넷 및 이동통신 사업자다. 로저스(Rogers), 벨(Bell)과 함께 캐나다의 3대 이동통신사 중 하나로 가입자 수는 약 960만명(점유율 28%)이다. 텔러스는 5G분야에 3년간 400억 캐나다 달러를 추가 투자할 계획이다.다렌 엔트위슬 텔러스 CEO(최고경영자)는 “통신기술 분야의 오랜 경험과 커넥티비티 분야의 전문성, 첨단 기술 등을 고려해 삼성전자를 공급사로 선정하게 됐다”고 말했다.전경훈 삼성전자 네트워크사업부장은 “5G 선도국에서 축적해 온 상용화 경험과 독보적인 네트워크 솔루션을 바탕으로 텔러스가 캐나다에서 5G 시대의 새 지평을 열어가는데 적극 협력할 것”이라고 말했다.park.jiyeong@heraldcorp.com"
005930,2020.06.19,8,서울경제,화웨이 버린 캐나다...삼성 5G 장비 택했다,https://finance.naver.com/item/news_read.nhn?article_id=0003755861&office_id=011&code=005930&page=1&sm=,"작년 비디오트론 이어 텔러스까지삼성, 해외 4번째 신규수주 쾌거[서울경제] 삼성전자(005930)가 캐나다 대형 이동통신사 ‘텔러스’에 5세대(5G) 통신 장비를 공급한다. 지난해 12월 ‘비디오트론’에 이어 캐나다에서 연이어 5G 장비를 수주하는 성과를 거둔 것이다.삼성전자는 지난해 12월 캐나다, 올해 2월 미국, 3월 뉴질랜드 통신사와의 5G 공급 계약에 이어 캐나다 텔러스에 신규 수주를 했다고 19일 밝혔다. 텔러스는 캐나다 전역에 초고속 통신서비스를 제공하는 통신 사업자로 5G 분야에 3년간 400억캐나다달러(약 35조7,000억원)를 추가로 투자할 계획이다. 삼성전자는 지난해 12월 비디오트론과 계약을 맺으며 처음 캐나다 시장에 진출한 후 이번에 다시 5G 장비를 공급하게 되면서 캐나다 통신장비 시장에서 입지를 다질 수 있게 됐다. 텔러스는 기존에 화웨이 장비를 사용하고 있었지만 5G 구축에는 화웨이를 배제하고 새롭게 삼성전자의 손을 잡은 사례다. 네트워크 장비 시장에서 장비 공급 업체를 아예 교체하는 것은 이례적인 일이다. 텔러스는 삼성전자 이외에도 에릭슨·노키아도 5G 장비 공급 업체로 선정했다. 다렌 엔트위슬 텔러스 최고경영자(CEO)는 “통신기술 분야의 오랜 경험과 커넥티비티 분야의 전문성, 첨단 기술 등을 고려해 삼성전자를 공급사로 선정하게 됐다”고 밝혔다. 특히 캐나다 3대 통신사인 로저스 커뮤니케이션과 벨캐나다·텔러스가 모두 5G 구축에 ‘화웨이 보이콧’을 했다. 3대 통신사의 가입자 합계가 캐나다 전체 인구의 약 82%에 달해 사실상 캐나다에서 화웨이 5G 장비를 사용하지 않게 된 셈이다.다만 미국의 제재가 일부 완화되고 유럽 통신사들이 속속 화웨이 5G 장비 도입에 속도를 높이고 있어 앞으로 5G 시장을 두고 삼성전자와 화웨이 간 치열한 경쟁이 이어질 것으로 전망된다. 시장조사기관 IHS마킷에 따르면 지난해 5G 장비 시장에서 화웨이는 26.2%로 1위를 차지했다. 그 뒤를 에릭슨(23.4%)과 삼성전자(23.3%) 순으로 잇고 있다. 전경훈 삼성전자 네트워크사업부장(사장)은 “여러 5G 선도국에서 축적해 온 상용화 경험과 독보적인 5G 네트워크 솔루션을 바탕으로 텔러스가 캐나다에서 새로운 5G 시대의 지평을 열어가는 데 적극 협력할 것”이라고 강조했다./권경원기자 nahere@sedaily.com[서울경제 바로가기]","작년 비디오트론 이어 텔러스까지삼성, 해외 4번째 신규수주 쾌거[서울경제] 삼성전자(005930)가 캐나다 대형 이동통신사 ‘텔러스’에 5세대(5G) 통신 장비를 공급한다. 지난해 12월 ‘비디오트론’에 이어 캐나다에서 연이어 5G 장비를 수주하는 성과를 거둔 것이다.삼성전자는 지난해 12월 캐나다, 올해 2월 미국, 3월 뉴질랜드 통신사와의 5G 공급 계약에 이어 캐나다 텔러스에 신규 수주를 했다고 19일 밝혔다. 텔러스는 캐나다 전역에 초고속 통신서비스를 제공하는 통신 사업자로 5G 분야에 3년간 400억캐나다달러(약 35조7,000억원)를 추가로 투자할 계획이다. 삼성전자는 지난해 12월 비디오트론과 계약을 맺으며 처음 캐나다 시장에 진출한 후 이번에 다시 5G 장비를 공급하게 되면서 캐나다 통신장비 시장에서 입지를 다질 수 있게 됐다. 텔러스는 기존에 화웨이 장비를 사용하고 있었지만 5G 구축에는 화웨이를 배제하고 새롭게 삼성전자의 손을 잡은 사례다. 네트워크 장비 시장에서 장비 공급 업체를 아예 교체하는 것은 이례적인 일이다. 텔러스는 삼성전자 이외에도 에릭슨·노키아도 5G 장비 공급 업체로 선정했다. 다렌 엔트위슬 텔러스 최고경영자(CEO)는 “통신기술 분야의 오랜 경험과 커넥티비티 분야의 전문성, 첨단 기술 등을 고려해 삼성전자를 공급사로 선정하게 됐다”고 밝혔다. 특히 캐나다 3대 통신사인 로저스 커뮤니케이션과 벨캐나다·텔러스가 모두 5G 구축에 ‘화웨이 보이콧’을 했다. 3대 통신사의 가입자 합계가 캐나다 전체 인구의 약 82%에 달해 사실상 캐나다에서 화웨이 5G 장비를 사용하지 않게 된 셈이다.다만 미국의 제재가 일부 완화되고 유럽 통신사들이 속속 화웨이 5G 장비 도입에 속도를 높이고 있어 앞으로 5G 시장을 두고 삼성전자와 화웨이 간 치열한 경쟁이 이어질 것으로 전망된다. 시장조사기관 IHS마킷에 따르면 지난해 5G 장비 시장에서 화웨이는 26.2%로 1위를 차지했다. 그 뒤를 에릭슨(23.4%)과 삼성전자(23.3%) 순으로 잇고 있다. 전경훈 삼성전자 네트워크사업부장(사장)은 “여러 5G 선도국에서 축적해 온 상용화 경험과 독보적인 5G 네트워크 솔루션을 바탕으로 텔러스가 캐나다에서 새로운 5G 시대의 지평을 열어가는 데 적극 협력할 것”이라고 강조했다./권경원기자 nahere@sedaily.com[서울경제 바로가기]"
005930,2020.06.19,8,머니투데이,"삼성, 캐나다 '텔러스'에 5G 통신장비 공급",https://finance.naver.com/item/news_read.nhn?article_id=0004427412&office_id=008&code=005930&page=1&sm=," [머니투데이 박효주 기자] 삼성전자가 캐나다 주요 이동통신 사업자 텔러스’(TELUS) 5G(세대) 이동통신 장비 공급사로 선정됐다고 19일 밝혔다.이번 5G 장비 공급은 지난해 12월 캐나다 비디오트론, 올 2월 미국 US 셀룰러, 3월 뉴질랜드 스파크에 이은 이은 네번째 신규 수주다. 특히 이번 수주를 통해 삼성전자는 캐나다에서 주요 통신장비 공급사로서 입지를 다질 수 있게 됐다.텔러스는 기존에 화웨이 장비를 100% 사용하고 있었으나, 다른 캐나다 사업자와 마찬가지로 5G 사업에 화웨이를 배제하고 있다. 대안으로 삼성전자와 에릭슨, 노키아를 장비 벤더로 선정했다. 네트워크 장비 시장에서 공급사를 아예 교체하는 것은 매우 이례적인 일로 꼽힌다.이번 삼성과 계약으로 텔러스는 5G 장비를 3개 회사에서 공급받을 예정이나, 아직 구체적으로 어떤 장비를 얼마나 공급할지는 확정되지 않았다.텔러스 다렌 엔트위슬 CEO는 ""통신기술 분야의 오랜 경험과 커넥티비티 분야의 전문성, 첨단 기술 등을 고려해 삼성전자를 공급사로 선정하게 됐다""며 ""이번 5G 생태계 확장은 세계 최고 수준의 5G 통신 경험을 제공하기 위한 텔러스의 조직적인 역량과 끈기, 선도적인 기상을 증명할 것""이라고 말했다. 전경훈 삼성전자 네트워크사업부장 사장은 ""여러 5G 선도국에서 축적해 온 상용화 경험과 독보적인 5G 네트워크 솔루션을 바탕으로 텔러스가 캐나다에서 새로운 5G 시대의 새 지평을 열어가는데 적극 협력할 것""이라고 말했다. 텔러스는 1990년 설립(민영화) 이후 인터넷과 이동통신 서비스를 제공해왔으며, 2000년부터 전국 유무선 통신망, 주파수 확보 및 망 운영에 약 2000억 캐나다 달러를 투자해오고 있다. 디지털 혁신을 여러 산업분야에 확산시키기 위해 5G에 3년간 400억 캐나다 달러를 추가로 투자할 계획이다.박효주 기자 app@"," [머니투데이 박효주 기자] 삼성전자가 캐나다 주요 이동통신 사업자 텔러스’(TELUS) 5G(세대) 이동통신 장비 공급사로 선정됐다고 19일 밝혔다.이번 5G 장비 공급은 지난해 12월 캐나다 비디오트론, 올 2월 미국 US 셀룰러, 3월 뉴질랜드 스파크에 이은 이은 네번째 신규 수주다. 특히 이번 수주를 통해 삼성전자는 캐나다에서 주요 통신장비 공급사로서 입지를 다질 수 있게 됐다.텔러스는 기존에 화웨이 장비를 100% 사용하고 있었으나, 다른 캐나다 사업자와 마찬가지로 5G 사업에 화웨이를 배제하고 있다. 대안으로 삼성전자와 에릭슨, 노키아를 장비 벤더로 선정했다. 네트워크 장비 시장에서 공급사를 아예 교체하는 것은 매우 이례적인 일로 꼽힌다.이번 삼성과 계약으로 텔러스는 5G 장비를 3개 회사에서 공급받을 예정이나, 아직 구체적으로 어떤 장비를 얼마나 공급할지는 확정되지 않았다.텔러스 다렌 엔트위슬 CEO는 ""통신기술 분야의 오랜 경험과 커넥티비티 분야의 전문성, 첨단 기술 등을 고려해 삼성전자를 공급사로 선정하게 됐다""며 ""이번 5G 생태계 확장은 세계 최고 수준의 5G 통신 경험을 제공하기 위한 텔러스의 조직적인 역량과 끈기, 선도적인 기상을 증명할 것""이라고 말했다. 전경훈 삼성전자 네트워크사업부장 사장은 ""여러 5G 선도국에서 축적해 온 상용화 경험과 독보적인 5G 네트워크 솔루션을 바탕으로 텔러스가 캐나다에서 새로운 5G 시대의 새 지평을 열어가는데 적극 협력할 것""이라고 말했다. 텔러스는 1990년 설립(민영화) 이후 인터넷과 이동통신 서비스를 제공해왔으며, 2000년부터 전국 유무선 통신망, 주파수 확보 및 망 운영에 약 2000억 캐나다 달러를 투자해오고 있다. 디지털 혁신을 여러 산업분야에 확산시키기 위해 5G에 3년간 400억 캐나다 달러를 추가로 투자할 계획이다.박효주 기자 app@"
